sentence,target,idx
One more pseudo generalization and I'm giving up.,0,1
One more pseudo generalization or I'm giving up.,0,2
"The more we study verbs, the crazier they get.",0,3
Day by day the facts are getting murkier.,0,4
I'll fix you a drink.,0,5
Fred watered the plants flat.,0,6
Bill coughed his way out of the restaurant.,0,7
We're dancing the night away.,0,8
Herman hammered the metal flat.,0,9
The critics laughed the play off the stage.,0,10
The pond froze solid.,0,11
Bill rolled out of the room.,0,12
The gardener watered the flowers flat.,0,13
The gardener watered the flowers.,0,14
Bill broke the bathtub into pieces.,0,15
Bill broke the bathtub.,0,16
They drank the pub dry.,0,17
The professor talked us into a stupor.,0,19
We yelled ourselves hoarse.,0,21
Harry coughed himself into a fit.,0,24
Bill followed the road into the forest.,0,27
We drove Highway 5 from SD to SF.,0,28
Fred tracked the leak to its source.,0,29
John danced waltzes across the room.,0,30
Bill urinated out the window.,0,31
Bill coughed out the window.,0,32
Bill bled on the floor.,0,33
The toilet leaked through the floor into the kitchen below.,0,34
Bill ate off the floor.,0,35
Bill drank from the hose.,0,36
This metal hammers flat easily.,0,37
They made him president.,0,38
They made him angry.,0,39
They made him into a monster.,0,43
The trolley rumbled through the tunnel.,0,44
The wagon rumbled down the road.,0,45
The bullets whistled past the house.,0,46
The knee replacement candidate groaned up the stairs.,0,47
The dog barked its way out of the room.,0,50
Bill whistled his way past the house.,0,51
The witch vanished into the forest.,0,52
Bill disappeared down the road.,0,53
The witch went into the forest and thereby vanished.,0,55
The building is tall and wide.,0,56
This building is taller and wider than that one.,0,58
This building got taller and wider than that one.,0,59
This building got taller and taller.,0,60
Bill floated into the cave.,0,64
Bill floated down the river for hours.,0,67
Bill floated down the river.,0,68
Bill pushed Harry along the trail for hours.,0,69
Bill pushed Harry along the trail.,0,70
The road zigzagged down the hill.,0,71
The rope stretched over the pulley.,0,72
The weights stretched the rope over the pulley.,0,73
The weights kept the rope stretched over the pulley.,0,74
Sam cut himself free.,0,75
Sam got free by cutting his finger.,0,76
Bill cried himself to sleep.,0,77
Bill squeezed himself through the hole.,0,79
Bill sang himself to sleep.,0,80
Bill squeezed the puppet through the hole.,0,81
Bill sang Sue to sleep.,0,82
"If the telephone rang, it could ring itself silly.",0,84
The tiger bled to death.,0,87
"He coughed awake and we were all overjoyed, especially Sierra.",0,88
"John coughed awake, rubbing his nose and cursing under his breath.",0,89
John coughed himself awake on the bank of the lake where he and Bill had their play.,0,90
Ron yawned himself awake.,0,91
She coughed herself awake as the leaf landed on her nose.,0,92
The worm wriggled onto the carpet.,0,93
The chocolate melted onto the carpet.,0,94
Bill wriggled himself loose.,0,96
Aliza wriggled her tooth loose.,0,97
The off center spinning flywheel shook itself loose.,0,98
"The more you eat, the less you want.",0,99
"If you eat more, you want correspondingly less.",0,100
"When you eat more, you want correspondingly less.",0,101
"As you eat more, you want correspondingly less.",0,102
"The angrier Sue gets, the more Fred admires her.",0,104
"The more that you eat, the less that you want.",0,105
"The angrier that Sue gets, the more that Fred admires her.",0,106
"I think that the more you eat, the less you want.",0,107
"I'm not shocked by the idea that the more you eat, the less you want.",0,108
"It is obvious that the more you eat, the less you want.",0,109
"It is not entirely clear if the more you eat, the less you want.",0,110
"I want to explain exactly why the more you eat, the less you want.",0,111
"I demand that the more John eats, the more he pays.",0,112
"I demand that John pay more, the more he eats.",0,114
"You get angrier, the more we eat, don't you.",0,116
"The harder it has rained, how much faster a flow appears in the river?",1,119
"The harder it rains, how much faster do you run?",1,121
"The harder it rains, how much faster a flow do you see in the river?",1,122
"When it rains harder, how much faster a flow appears in the river?",1,124
"As it rains harder, how much faster a flow appears in the river?",1,125
"How much harder has it rained, the faster a flow you see in the river?",1,128
"How much harder has it rained, when you see a faster flow in the river?",1,129
"When John eats more, keep your mouth shut tighter, OK?",1,132
"As John eats more, keep your mouth shut tighter, OK?",1,133
"Keep your mouth shut tighter, the more John eats, OK?",1,134
"Everyone keep your mouth shut tighter, the more John eats, OK?",1,135
Bill can well imagine getting fat.,0,137
"Fred can well imagine Joe getting fatter, the more he eats.",0,139
"It is important for you to be more careful, the more you eat.",0,149
"It is important to be more careful, the more you eat.",0,150
Mary listens to the Grateful Dead and she gets depressed.,0,156
"If Mary listens to the Grateful Dead, she gets depressed.",0,157
"When Mary listens to the Grateful Dead, she gets depressed.",0,158
Mary gets depressed if she listens to the Grateful Dead.,0,159
Mary gets depressed when she listens to the Grateful Dead.,0,160
"The more she looked at pictures, the angrier Mary got.",0,161
Mary gets depressed and she listens to the Grateful Dead.,0,163
"The higher the stakes are, the lower his expectations are.",0,164
"The higher the stakes, the lower his expectations.",0,165
"His expectations are lower, the higher the stakes.",0,166
"His expectations are lower, the higher the stakes are.",0,167
"The more obnoxious Fred is, the less attention you should pay to him.",0,170
"The more Fred is obnoxious, the less you should pay attention to him.",0,172
His expectations are always lower than mine.,0,174
John was lots more obnoxious than Fred was.,0,175
"You should always lock your door, no matter how fancy the hotel might be.",0,176
"You should always lock your door, no matter how fancy the hotel.",0,177
"I don't plan to lock the door, no matter how fancy this hotel is.",0,178
"I'm going out, whatever the weather.",0,180
"I'm going out, wherever that hurricane might be.",0,181
The more examples Mary says that Bill has helped Fred to discover the less I believe her.,0,183
The more carefully he words the letter the safer he'll be.,0,189
"The more geniuses John meets, the angrier he gets.",0,191
"The more people you say will buy tickets, the happier I'll be.",0,193
"The more people you say that right after the show opens will buy tickets, the happier I'll be.",0,195
"The more I talk to Joe, the less about linguistics I am inclined to think Sally has taught him to appreciate.",0,196
"The richer John gets, the more geniuses John meets.",0,203
"The more articles he reads, the fewer people he thinks will go into linguistics.",0,205
"The more articles he reads, the fewer people he thinks that under the current circumstances will go into linguistics.",0,207
"The more articles he reads, the fewer people he thinks under the current circumstances will go into linguistics.",0,208
"The more people that arrive, the louder that it gets.",0,209
"The more people that arrive, the louder it gets.",0,210
"The more people you give beer to, the more people that get sick.",0,211
"The more people that you give beer to, the more people that get sick.",0,212
"The more people arrive, the louder that it gets.",0,213
"The more people arrive, the louder it gets.",0,214
"The more people that you give beer to, the more people get sick.",0,215
The more pictures of himself that John buys the more arrogant he becomes.,0,217
The man that arrived on the train was my brother.,0,218
"Whenever Bill smokes, Susan hates him all the more.",0,222
"Whenever Bill smokes, Susan hates him much more.",0,223
"Whenever Bill smokes, Susan hates him far more.",0,224
"Whenever Bill smokes, Susan hates him a lot more.",0,225
"Once Janet left, Fred became all the crazier.",0,226
"Once Janet left, Fred became much crazier.",0,227
"Once Janet left, Fred became far crazier.",0,228
"Fred became all the crazier, the more often Janet left.",0,229
"When Bill smokes, all the more does Susan hate him.",0,230
So much did you eat that everyone gasped.,0,233
So fast did you run that everyone gasped.,0,234
So intelligent a dog did you buy that everyone gasped.,0,235
I know how much you ate.,0,236
I know how fast you ran.,0,237
I know how intelligent a dog you bought.,0,238
He ate so much that he got sick.,0,239
So much did he eat that he got sick.,0,240
"The more you eat, the more you want.",0,241
I wonder to how many people Bill talks.,0,245
"The longer he has to wait, the angrier John gets.",0,246
"If he has to wait, John gets angry.",0,247
"The more that pictures of him appear in the news, the more embarrassed John becomes.",0,250
"The more pictures of himself that appear in the news, the more embarrassed John becomes.",0,251
"The more that pictures of himself appear in the news, the more embarrassed John becomes.",0,252
"The more pictures of him appear in the news, the more likely John is to get arrested.",0,253
"The more that pictures of him appear in the news, the more likely John is to get arrested.",0,255
"The more that John gets upset by them, the more that stories about him seem to show up in the news.",0,257
"John is more embarrassed, the more pictures of him appear in the news.",0,259
"John is more embarrassed, the more pictures of him that appear in the news.",0,260
"John is more embarrassed, the more pictures of himself appear in the news.",0,261
"John is more embarrassed, the more pictures of himself that appear in the news.",0,262
"Stories about him seem to show up more on the evening news, the more that John gets upset by them.",0,263
"If you give him enough opportunity, every senator will succumb to corruption.",0,265
You give him enough opportunity and every senator will succumb to corruption.,0,266
"If you give any senator enough opportunity, he will succumb to corruption.",0,268
You give any senator enough opportunity and he will succumb to corruption.,0,269
"The more lobbyists he talks to, the more corrupt every senator seems to become.",0,273
"The more lobbyists wine and dine him, the more every senator is susceptible to corruption.",0,274
"Every senator becomes more corrupt, the more lobbyists he talks to.",0,276
"Any senator becomes more corrupt, the more lobbyists he talks to.",0,277
"Every senator seems to become more corrupt, if he talks to more lobbyists.",0,280
"Any senator seems to become more corrupt, if he talks to more lobbyists.",0,281
"Any senator seems to become more corrupt, as he talks to more lobbyists.",0,282
"The sooner you solve this problem, the more easily you'll satisfy the folks up at corporate headquarters.",0,287
This is the sort of problem which the sooner you solve the more easily you'll satisfy the folks up at corporate headquarters.,0,288
"The folks up at corporate headquarters are the sort of people who the sooner you solve this problem, the more easily you'll satisfy.",0,289
"This problem, the sooner you solve the more easily you'll satisfy the folks up at corporate headquarters.",0,290
Who did you give pictures of to friends of?,1,291
It is this problem that the sooner you solve the more easily you'll satisfy the folks up at corporate headquarters.,0,292
"The harder that it rains, how much faster a flow do you see in the river?",1,299
"They failed to tell me which problem the sooner I solve, the quicker the folks up at corporate headquarters.",0,300
This is a problem that you'll be able to tell the folks up at corporate headquarters to buzz off if you solve it.,0,304
John saw the man in the room.,0,309
Which room did John see the man in?,1,310
Who did John think that Bill claimed that Mary suspected that everybody liked?,1,311
John could not visit Sally.,0,312
What John could do is not visit Sally.,0,313
John couldn't visit Sally.,0,314
Why did John leave?,1,315
I hit the ball.,0,316
You hit the ball.,0,317
They hit the ball.,0,320
I am not going.,0,322
Aren't I going?,1,323
"Louise is unhappy, isn't she?",1,325
"Louise likes not being happy, doesn't she?",1,326
"Not many books survived the fire, did they?",1,327
"No books survived the fire, did they?",1,328
"He hasn't often paid taxes, has he?",1,329
"He can't pay taxes, can he?",1,330
She does not see him.,0,331
She kept not seeing him.,0,332
She could not have been working.,0,333
He could not have been working.,0,336
He cannot have been working.,0,337
He can simply not have been working.,0,338
You must not simply not work.,0,339
He may not just not have been working.,0,340
He can't have been working.,0,341
Can't he have been working?,1,342
Can he not have been working?,1,343
John wrote books.,0,345
John did not write books.,0,348
"`` I am so happy '', thought John.",0,350
down the hill rolled John.,0,351
John often kisses Mary.,0,353
Who do you think Mary said John likes?,1,354
Who do you think that Mary said that John likes?,1,356
How do you think that Mary solved the problem?,1,358
How did you think that Mary solved the problem?,1,362
Mary hired someone.,0,363
I heard that Mary hired someone.,0,364
I resigned because Mary hired someone.,0,365
Mary wondered which picture of himself Bill saw?,1,366
Which picture of himself does Mary think that John said that Susan likes?,1,367
"Mary thinks that John said that pictures of himself, Susan likes?",1,369
"If you don't believe me, you will the weatherman?",1,370
"I rolled up a newspaper, and Lynn did a magazine?",1,371
"Kathy likes astronomy, but she doesn't meteorology?",1,372
The DA proved Jones guilty and the Assistant DA will prove Smith.,0,373
"Mary will believe Susan, and you will Bob.",0,374
You might not believe me but you will Bob.,0,375
How did you solve the problem?,1,377
I wonder who could solve the problem in this way.,0,378
No candidate can predict how many people will vote for him.,0,380
Every politician is worried when the press starts attacking him.,0,381
Which politician appointed the journalist who supported him?,1,382
"John sells books, Mary buys records and Bill V newspapers.",0,384
The question of whether John met Mary worries the people who support.,0,385
They have left.,0,386
Have they left?,1,387
Could they have left?,1,388
He has often seen Mary.,0,389
He I often sees Mary.,0,390
It seems that it is likely that John will win.,0,393
It seems that John is likely to win.,0,394
John seems to be likely to win.,0,395
How intelligent do you consider John?,1,399
He has left.,0,403
His book is nice.,0,404
Bill saw him.,0,405
Bill works with him.,0,406
John believes him to be a nice guy.,0,407
John considers him a nice guy.,0,408
For him to do that would be a mistake.,0,409
"With him sick, the team is in trouble.",0,410
John believes that he is sick.,0,415
Who do you think that Bill likes?,1,419
Who do you think that Bill believes to be innocent?,1,420
Someone stole my car.,0,423
My car was stolen.,0,424
John has often kissed Mary.,0,426
The kids have all eaten the chocolate.,0,427
"In general, he understands what's going on.",0,428
It's probable that in general he understands what's going on.,0,429
I explained how to fix the sink.,0,432
I explained how we should fix the sink.,0,433
I explained that we should fix the sink.,0,434
Mickey looked up the reference.,0,436
Mickey looked the reference up.,0,437
Mickey looked up them.,0,438
Mickey teamed up with the women.,0,439
Mickey pointed out that Gary had left.,0,441
Mickey slips up all the time.,0,443
What does John think Mary bought?,1,445
John wonders what Mary bought.,0,447
Who bought what?,1,451
Who is reading a book that criticizes who?,1,452
Who remembers where we bought what?,1,453
There aren't many linguistics students here.,0,456
I haven't met many linguistics students.,0,457
What does every student buy?,1,458
I need Sally to be there.,0,459
The boat was sunk to collect the insurance.,0,461
John wants to win.,0,462
The bed was unmade.,0,463
John was unknown.,0,465
We knew John to be the murderer.,0,467
He fed the children.,0,468
The children were uneducated.,0,469
The children were undisciplined.,0,470
I believed these students all to like John.,0,471
They tried to all like John.,0,472
I believed these students to all like John.,0,473
Did you believe him ever to have made an effort to talk to the student?,1,475
Did he try to ever be attentive to the needs of students?,1,476
Did you believe him to ever have made an effort to talk to the student?,1,477
work out an analysis that is typical of this view of understood subjects.,0,478
They were believed all to be quite diligent.,0,479
Was he believed ever to fail students?,1,480
There is tending to be more and more discussion of these issues.,0,481
John seemed to be a great linguist.,0,482
There promises to be a storm tonight.,0,483
John strived to be successful.,0,484
John wanted to improve his lot in life.,0,485
John expected to win.,0,486
This book is too dense to be read in one sitting.,0,487
John tried.,0,489
John remembered.,0,490
John is refused.,0,491
John forgot.,0,492
They seemed all to like John.,0,497
John believes Sally to be polite.,0,498
I believe John with all my heart to be a fine person.,0,499
We would like John to win.,0,502
We would prefer John to be the candidate.,0,505
I would like for John to win.,0,506
I would hate for John to win.,0,507
I would prefer for John to be the candidate.,0,508
John destroyed the house.,0,509
The electrode emitted ions into the medium.,0,510
Ions struck the electrode.,0,511
The medium contains ions.,0,512
Ions left the electrode.,0,514
The electrode was struck by ions.,0,516
The ball lies in the box.,0,517
The ball rolled from the bush to the tree.,0,518
The box contains the ball.,0,519
The tree dropped fruit to the ground.,0,520
Fruit hit the ground from the tree.,0,521
The stone knocked against the pole into the road.,0,522
The stone knocked the pole into the road.,0,523
The box contained the ball.,0,524
The tree gradually dropped its fruit to the ground.,0,528
The tree dropped its fruit to the ground.,0,529
Fruit hit the roof.,0,530
Fruit hit the roof from the tree.,0,531
Fruit at once hit the roof from the tree.,0,532
Fruit dropped from the tree.,0,535
The tree changed into an oak.,0,539
The tree changed from a maple into an oak.,0,540
The maple changed into an oak from a cedar.,0,542
The maple changed into an oak.,0,543
The oak developed out of a maple.,0,544
The train reached the station.,0,545
The branches knocked against the wall.,0,546
The child became a man.,0,547
The party lasted till midnight.,0,548
The dog went crazy.,0,549
It struck John that it was so.,0,550
It came to John that it was so.,0,551
The snake saw into the nest.,0,552
Hard work resulted in high grades.,0,553
The farm passed to John.,0,554
John is touching the wall.,0,555
The wall is being touched by John.,0,556
A bear occupies the cave.,0,557
A bear inhabits the cave.,0,558
Water fills the tub.,0,559
The electric main joins the house circuit in the basement.,0,560
The house circuit is joined by the electric main in the basement.,0,561
The fence straddles the sidewalk.,0,562
The sidewalk is straddled by the fence.,0,563
The man with a book.,0,564
Gas escaped the tube.,0,565
The terrorist escaped the prison cell.,0,566
The prison cell was escaped by the terrorist.,0,567
The rolling stone avoided the river.,0,568
The river was avoided by the rolling stone.,0,569
The agents caught the terrorist.,0,570
The sponge soaked up the water.,0,571
The tub filled with water.,0,572
John received a book.,0,573
John learned a lesson.,0,574
The parcel reached John.,0,575
John received the parcel.,0,576
The farm finally got to John after much litigation.,0,577
Water filled the cup high.,0,579
Water filled the cup.,0,580
The cup filled with water.,0,584
the barge piled high with logs.,0,586
a stone blocked the road.,0,590
the branch dropped its apple free.,0,592
Some branches broke off of the tree.,0,593
The tree dropped some branches.,0,595
The tree lost some branches.,0,596
Water bubbled out of the kettle.,0,597
The kettle bubbled water.,0,599
The tub leaked empty of water.,0,602
Hail stones broke the window.,0,604
The force of the wind broke the window.,0,605
The window broke from the force of the wind.,0,607
What the force of the wind did to the window was break it.,0,608
John hit the stone against the wall.,0,609
John hit the wall with the stone.,0,610
John tapped some wine from a barrel.,0,611
John tapped a barrel of some wine.,0,612
John laid the book on the table.,0,613
John included his name in the list.,0,614
John loaded the bricks onto the truck.,0,615
John loaded the truck with bricks.,0,616
John fed rice to the baby.,0,617
John fed the baby rice.,0,618
John fed the baby up with rice.,0,619
The ball lies completely in the box.,0,621
The box completely contains the ball.,0,622
The train got to the station fully.,0,623
The train reached the station fully.,0,624
Press the stamp against the pad completely.,0,625
Press the pad with the stamp completely.,0,626
Spray the paint onto the wall completely.,0,627
Spray all the paint onto the wall completely.,0,628
Spray the whole wall with the paint.,0,630
What John did to the wall was paint it.,0,631
What John did to the whole wall was paint it.,0,632
What John did to the wall was hit it.,0,633
John took Bill to be a fool.,0,636
Give the bottle to the baby full.,0,638
Give the baby the bottle full.,0,640
Rub the cloth on the baby torn.,0,642
Rub the baby with the cloth torn.,0,644
Dry the baby with the cloth asleep.,0,646
The stone knocked the cup apart.,0,649
The cup smashed apart against the stone.,0,650
The stone smashed the cup apart.,0,651
The tank filled with petrol out of the pump.,0,652
The cup emptied of water onto the ground.,0,653
John included her name in the list.,0,654
John rolled the ball from the tree to the bush.,0,655
John tapped the bottle of some water.,0,656
John gave Bill the book.,0,657
John got the book from Bill.,0,658
We have someone in the living room.,0,660
John is very fond of Mary.,0,661
Mary laughed at John.,0,662
The ship sank beneath the waves.,0,663
Mary considers John a fool and Bill a wimp.,0,664
John regards professors as strange and politicians as creepy.,0,665
Sue put the books on the table and the records on the chair.,0,666
Harriet gave a mug to John and a scarf to Vivien.,0,667
I expect John to win and Harry to lose.,0,668
You eat the fish raw and the beef cooked.,0,669
They told Sue who to talk to and Virginia when to leave.,0,670
"Smith loaned, and his widow later donated, a valuable collection of manuscripts to the library.",0,671
"Sue moved, and Mary also transferred, her business to a different location.",0,672
"I succeeded in convincing, even though John had failed to persuade, Mary not to leave.",0,673
"We didn't particularly like, but nevertheless ate, the fish raw.",0,674
"Flo desperately wants, though she doesn't really expect, the Miami Dolphins to be in the play-offs.",0,675
John learned French perfectly.,0,676
Bill recited his lines poorly.,0,677
Mary plays the violin beautifully.,0,678
John learned French immediately.,0,681
Bill recited his lines slowly.,0,682
Mary will play the violin soon.,0,683
John immediately learned French.,0,684
Bill slowly recited his lines.,0,685
Mary will soon play the violin.,0,686
John immediately learned French perfectly.,0,687
John learned French perfectly almost immediately.,0,688
John learned French perfectly immediately.,0,689
John rolled the ball perfectly down the hill.,0,696
John rolled the ball down the hill perfectly.,0,697
John shot the ball perfectly.,0,699
John spoke intimately to Mary.,0,701
John spoke to Mary intimately.,0,702
John spoke French intimately to Mary.,0,703
John spoke French to Mary intimately.,0,704
Mary jumped the horse perfectly over the last fence.,0,705
Mary jumped the horse over the last fence perfectly.,0,706
We consider the men all fools.,0,712
We consider the men all totally crazy.,0,713
The teacher ordered the two boys both to pay close attention.,0,717
They returned the books all to their owners.,0,718
We painted the chairs all red.,0,719
The trainer fed the steaks all to the lions.,0,720
Mary left the room angry.,0,723
John resembles Bill.,0,726
The package weighed 10 lb.,0,728
This book cost $10.,0,730
The book cost John $10.,0,732
We proclaimed John to the public to be a hero.,0,746
We proclaimed John sincerely to be a hero.,0,748
We proclaimed John sincerely to the public to be a hero.,0,750
They represented Mary to the dean as a genuine linguist.,0,752
They represented Mary seriously as a genuine linguist.,0,754
They represented Mary seriously to the dean as a genuine linguist.,0,755
We proved Smith conclusively to be the thief.,0,758
We proved Smith conclusively to the authorities to be the thief.,0,760
The gardener watered the tulips flat.,0,761
The grocer ground the coffee beans to a fine powder.,0,762
They painted their house a hideous shade of green.,0,763
The joggers ran their Nikes threadbare.,0,764
The kids laughed themselves into a frenzy.,0,765
He coughed his handkerchief completely soggy.,0,766
They fed the meat to the lions raw.,0,767
We love them.,0,769
Our love they.,0,773
Our love them.,0,774
Our love their.,0,775
his belief that Mary kissed Bill is mistaken.,0,778
Mary loves him.,0,779
Mary is fond of him.,0,780
Mary criticized him.,0,782
Mary's criticism of him was cruel.,0,784
That John loves Mary is doubtful.,0,785
For John to love Mary would be doubtful.,0,787
To go abroad would be nice.,0,788
John's plan to go abroad is nice.,0,789
Mary believed John to have loved her.,0,790
Mary considered John to have loved her.,0,791
Mary reported John to have loved her.,0,792
