sentence,target,idx
Because of the strike the commuters travelled by army lorry.,0,6742
The commuters travelled by army lorry because of the strike.,0,6743
"Because the bus drivers were on strike, the commuters travelled by army lorry.",0,6744
The commuters travelled by army lorry because the bus drivers were on strike.,0,6745
Although Mr D'Arcy disliked Mrs Bennet he married Elizabeth.,0,6746
"In spite of his dislike of Mrs Bennet, Mr D'Arcy married Elizabeth.",0,6747
"If Emma had left Hartfield, Mr Woodhouse would have been unhappy.",0,6748
Did Captain Wentworth write a letter to Anne Elliott?,1,6749
Write a letter to Anne Elliott.,0,6750
The girls wondered who Mr Bennet had received in his library.,0,6756
We were wondering who did you meet at the conference.,0,6757
She said that in came Aunt Norris.,0,6758
She said that into the room came Aunt Norris.,0,6759
Never had Sir Thomas been so offended.,0,6765
"Dr Jones habitually ate too much rich food, didn't he?",1,6769
Fanny stopped talking because in came Aunt Norris.,0,6774
Mr Yates left because never had Sir Thomas been so offended.,0,6776
Fanny had just stopped talking when in came Aunt Norris.,0,6782
Fanny regretted talking to Mary.,0,6783
Henry wanted to marry Fanny.,0,6784
"Mrs Bennet having taken the others upstairs, Mr Bingley proposed to.",0,6785
All Mr Collins does is praise Lady de Bourg.,0,6786
Lady de Bourg tried to persuade Elizabeth to renounce Mr D'Arcy.,0,6787
Henry wanted to have married Fanny before Edmund returned.,0,6788
Fanny regretted having talked to Mary.,0,6789
What Mr Collins is doing is praising Lady de Bourg.,0,6790
Julia and Maria wanted to be allowed to perform a play.,0,6793
Edmund wanted Fanny to be able to ride a horse.,0,6794
Fanny loved talking to Mary.,0,6796
"Slamming the door, he ran down the steps.",0,6797
"When ripe, these apples will be delicious.",0,6799
The tigers hunt prey at night.,0,6800
Fiona hoped to meet the Prime Minister.,0,6801
Arthur tried to bake a cake.,0,6802
Fiona persuaded Arthur to bake a cake.,0,6803
Susan wanted Jane to study German.,0,6804
Ayala went to the ball and chatted to Jonathan Stubbs.,0,6805
Ayala went to the ball and was chatted to by Jonathan Stubbs.,0,6807
All the Beatles came to Merle Park.,0,6808
The Beatles all came to Merle Park.,0,6809
Both Jane and Elizabeth were at home.,0,6810
Jane and Elizabeth were both at home.,0,6811
Larry hunted all the foxes.,0,6812
George built both the houses.,0,6815
All the foxes were hunted by Larry.,0,6818
Augusta blamed herself for what happened.,0,6819
These documents Elizabeth is checking at this very moment.,0,6820
Louise broke the cup.,0,6821
Alison drove the car.,0,6822
Martha chewed the bread.,0,6823
The cup was broken by Louise.,0,6824
The car was driven by Alison.,0,6825
The bread was chewed by Martha.,0,6826
These fields were marched over by all the armies of Europe.,0,6827
How is someone to chat to a girl if she does not go out?,1,6828
All the armies of Europe marched over these fields.,0,6829
Ayala sent back the diamond necklace.,0,6830
Ayala sent the diamond necklace back.,0,6831
Ayala sent her cousin the diamond necklace.,0,6832
Tatiana wrote to Onegin.,0,6834
Frank bought a piano for Jane.,0,6835
Lucy sent a letter to Jane.,0,6836
Lucy sent Jane a letter.,0,6837
The company sent China its senior mining engineers to help plan the new mines.,0,6838
Who did John send a book to?,1,6844
To whom did John send a book?,1,6845
What place did you travel to?,1,6846
To what place did you travel?,1,6847
What place did John send the book?,1,6848
Only to the best students would he give this book.,0,6851
Only to Glasgow would he go by train.,0,6853
It is to the best students that he gives this book.,0,6855
It is to Ireland that he is going.,0,6857
He told her the whole story.,0,6859
She told him the whole story.,0,6860
The other plan she rejected out of hand.,0,6861
The vase got broken that Sheila had brought all the way from.,0,6862
The plan was rejected out of hand that traffic should be banned.,0,6863
Norman Lemming jumped off the cliff and William Lemming did so too.,0,6864
Norman Lemming jumped off the cliff and so did William Lemming.,0,6865
Harriet couldn't marry Mr Knightley but Emma could.,0,6866
What Harriet did was marry Mr Martin.,0,6867
Marry Mr Martin was what Harriet did.,0,6868
Emma insulted Miss Bates and annoyed Mr Knightley.,0,6869
Harriet swooned.,0,6870
The book is astonishingly boring.,0,6871
The Ethel we all know and love wishes to ask you some awkward questions.,0,6872
Golfers can be good company.,0,6873
Enthusiastic golfers with large handicaps can be good company.,0,6874
These enthusiastic golfers that I met at the nineteenth hole can be good company.,0,6875
Memo ate the spaghetti.,0,6877
Memo liked lasagna.,0,6878
Emma made Harriet her friend.,0,6879
The quiche and I were cooking.,0,6880
Erika made her mother an omelet and the kitchen a mess.,0,6881
Bill went to London on Monday.,0,6882
Bill went on Monday to London.,0,6883
My brother lives near Strasbourg.,0,6884
Near Strasbourg my brother lives.,0,6885
He planted the garden with roses last November.,0,6886
He planted the garden last November with roses.,0,6887
The baby chewed the biscuit.,0,6888
The baby is heavy.,0,6889
What the baby did was chew the biscuit.,0,6890
The baby was chewing the biscuit.,0,6891
Chew the biscuit!,0,6892
Hartfield House is in Surrey.,0,6893
Mr Knightley rode to Kingston.,0,6894
Eleanor and Marianne travelled from Shropshire.,0,6895
Frank gave a piano to Jane Fairfax.,0,6896
Jane Fairfax received a piano from Frank.,0,6897
The thief smashed the window with a hammer.,0,6898
Captain Wentworth recovered the property for Mrs Smith.,0,6899
The window was broken by a hammer.,0,6900
Wren built St Paul's Cathedral.,0,6901
Siobhan burnt a pattern on the piece of wood.,0,6902
The dog dug a hole in the lawn.,0,6903
The vase stood on the table in the hall.,0,6904
Imogen took the vase to her mother's.,0,6905
Imogen broke the vase.,0,6906
Sue knows the answer.,0,6907
The answer is known to Sue.,0,6908
Jim was happily chopping logs.,0,6909
Jim was chopping logs when Margaret left and was still at it when she got back.,0,6910
Jim was enthusiastically chopping logs.,0,6911
Captain Oates died in order to save his comrades.,0,6912
This arch supports the weight of the tower.,0,6913
What this arch does is support the weight of the tower.,0,6914
This arch is supporting the weight of the tower.,0,6915
The computer is playing six simultaneous games of three dimensional chess.,0,6916
The intense cold killed the climbers.,0,6917
The climbers were killed by the intense cold.,0,6918
The climbers were killed with the intense cold.,0,6919
Catriona opened the door with this key.,0,6920
The visas are with the passports.,0,6921
Sally went to the party with Andrew.,0,6922
Alan made the loaf with strong white flour.,0,6923
The builders made the wall with concrete blocks.,0,6924
The gardener planted roses in the garden.,0,6925
It was roses that the gardener planted in the garden.,0,6926
It is the garden that the gardener planted with roses.,0,6927
Roses are certain to be planted in the garden by the gardener.,0,6928
The garden is certain to be planted with roses by the gardener.,0,6929
Helen sent a scarf to Jim for Margaret.,0,6930
What happened was they went home.,0,6931
They're believing everything you say.,0,6934
You'll soon be owning all the land round here.,0,6935
What she did was e-mail all her friends.,0,6936
Harriet talked to Emma for hours.,0,6940
The dog chased the cat for days.,0,6941
Harriet told Emma the whole story.,0,6942
The dog caught the cat.,0,6943
The beaver built a dam.,0,6944
Anne played the tune on the piano.,0,6945
Jane was playing the piano.,0,6946
Jane played the piano.,0,6947
Tess was knocking at the door.,0,6948
Tess knocked at the door.,0,6949
Frank Churchill was crossing the street.,0,6950
Jane is visiting Emma.,0,6951
Jane visits Emma.,0,6952
Tess is knocking at the door.,0,6953
Tess knocks at the door.,0,6954
Frank Churchill is crossing the street.,0,6955
Frank Churchill crosses the street.,0,6956
Real play Valencia next Sunday.,0,6957
I leave for Paris next week.,0,6958
The Minister has arrived.,0,6960
I've been at work for six hours.,0,6961
Have you ever visited Doubtful Sound?,1,6962
There was an attack yesterday.,0,6963
Emma and Harriet were attacked by those bandits.,0,6964
Those bandits attacked Emma and Harriet yesterday.,0,6965
The vase was smashed deliberately.,0,6966
The sheep got infected with scrapie.,0,6967
The fans were deliberately provoked by a rival group.,0,6968
The fans got deliberately provoked by a rival group.,0,6969
Six students got shot accidentally.,0,6970
Some gifts get used a dozen or so times a year.,0,6971
Can't you see I'm reading?,1,6972
People go hunting in the Autumn.,0,6973
We spent yesterday cooking.,0,6974
She buys for Harrods.,0,6975
I saw and he chops.,0,6976
This sweater washes well.,0,6977
This book reads well.,0,6978
These cars sold very quickly last week.,0,6979
It will take years for the Mersey to clean.,0,6980
The course is jumping well.,0,6981
One bomb didn't guide and crashed.,0,6982
Fiona may be here by 5 o'clock.,0,6983
"If Fiona is here by 5 o'clock, we can go to the party.",0,6984
It's high time Fiona got a job.,0,6985
Pat is either stupid or a liar.,0,6987
Pat is a Republican and proud of it.,0,6988
Pat is healthy and of sound mind.,0,6989
Pat is either asleep or at the office.,0,6990
That was a rude remark and in very bad taste.,0,6991
Sandy is either a lunatic or under the influence of drugs.,0,6992
I am hoping to get an invitation and optimistic about my chances.,0,6993
I am neither an authority on this subject nor trying to portray myself as one.,0,6994
Pat was neither recommended for promotion nor under any illusions about what that meant.,0,6995
Pat has become a banker and very conservative.,0,6996
I consider that a rude remark and in very [NP and PP] bad taste.,0,6997
The scene of the movie was in Chicago.,0,6998
John sang beautifully.,0,7000
John sang a carol.,0,7001
Kim sang and Sandy danced.,0,7003
Kim and Sandy met.,0,7004
Kim sang and was accompanied by Sandy.,0,7005
Kim was a banker.,0,7008
Dana was quite competent.,0,7009
Leslie was in the flood zone.,0,7010
Ronnie was talking to Lou.,0,7011
Jean was given a prize.,0,7012
Pat has become a Republican.,0,7013
Gerry became quite conservative.,0,7014
Pat became a republican and quite conservative.,0,7018
We walked slowly and with great care.,0,7022
They wanted to leave tomorrow or on Tuesday.,0,7023
"We are open Saturdays, any national holiday, and on alternate.",0,7024
Kim alienates cats and beats his dog.,0,7025
Kim alienates cats and beat his dog.,0,7026
Kim alienated cats and beats his dog.,0,7027
Kim alienated cats and beat his dog.,0,7028
Which student's grades went unreported?,1,7033
They found pictures of themselves.,0,7034
Who did you say my talking to would bother?,1,7036
Which article did Terry file without reading?,1,7037
Which books did Robin read and hate?,1,7038
They talked to Kim and to each other.,0,7042
He hated himself and his friends.,0,7043
They were wary of themselves and of each other.,0,7044
They asked which students and which teachers would get along together.,0,7045
We called up every man whose father and whose mother had played on the team.,0,7046
I went to the store and bought some whiskey.,0,7047
She's gone and ruined her dress now.,0,7048
I've got to try and find that screw.,0,7049
She goes and buys some whiskey.,0,7050
I have gone and bought some whiskey.,0,7051
I will go and buy some whiskey.,0,7052
I will try and buy some whiskey.,0,7053
I went to the store and I bought some whiskey.,0,7061
I've got to try and I've got to find that screw.,0,7062
I both went to the store and bought some whiskey.,0,7063
I've got to both try and find that screw.,0,7064
Here's the whiskey which I went to the store and bought.,0,7065
Which dress has she gone and ruined now?,1,7066
The screw which I've got to try and find holds the door to the frame.,0,7067
Either we Americans or I myself will get ourselves in trouble.,0,7068
Either you or I will incriminate ourselves.,0,7069
You and I may incriminate ourselves.,0,7070
We Americans and the British pamper ourselves.,0,7071
You British and you Americans pamper yourselves.,0,7072
You British or you Americans will get yourselves in trouble.,0,7073
You and Kerry have outdone yourselves.,0,7074
You or Kerry have perjured yourselves.,0,7075
The boys and the girls seem happy.,0,7076
Either the boys or the girls are going to be there.,0,7078
The students and Professor Swansong are meeting in the park.,0,7079
Either Professor Swansong or the graduate students are going to proctor the exam.,0,7080
Either Dana or Lee is going to lead the parade.,0,7081
Kim and Terry are happy.,0,7082
Either Dana or Lee are going to lead the parade.,0,7086
"Kim likes Sandy, and Lee Leslie. to try to go to Rome.",0,7087
"Pat wanted to try to go to Berne, and Chris to go to Rome. to Rome.",0,7088
"Kim went to the store, and then Lou.",0,7089
"Some people go by car, but others by bike.",0,7090
"Some people like bagels, but others cream cheese.",0,7091
"On weekdays, Terry eats meat and vegetables, but on weekends, only vegetables.",0,7092
"John gave the books to Mary at Christmas, and the records to Sue for her birthday.",0,7094
"John talked to his supervisor about his thesis, and Erich to the dean about department politics.",0,7095
"A businessman will drink a martini to relax, and a health nut, a glass of wine, just to remain healthy.",0,7096
"John left his office at 11 and at 12, the library.",0,7098
"A policeman walked in at 11, and at 12, a fireman.",0,7099
"Two days ago, we went out to dinner, and this afternoon, to the movies.",0,7100
"On this table, they put a lamp, and on that table, a radio.",0,7101
John didn't give the books to Mary and the papers to Sue.,0,7103
"Leslie is rather foolish, and Lou a complete idiot.",0,7109
"Kim seems to be just surviving, and Terry in dire need of our help.",0,7110
"We consider Leslie rather foolish, and Lou a complete idiot.",0,7111
"Pat has become crazy, and Chris an incredible bore.",0,7112
Pat remembered the appointment and that it was important to be on time.,0,7115
That Goldstein appointed Heydrich and the implications thereof frightened many observers.,0,7116
We talked about Mr. Colson and that he had worked at the.,0,7117
You can depend on my assistant and that he will be on time.,0,7118
Pat was annoyed by the children's noise and that their parents did nothing to stop it.,0,7119
We talked about the issues we had worked on as students and that our perspectives had changed over the years.,0,7123
That our perspectives had changed over the years and the issues we had worked on as students were the topics of discussion.,0,7125
The clever snake disappeared into a hole in the ground.,0,7126
This girl in the red coat will put a picture of Bill on your desk before tomorrow.,0,7133
Bill will put a picture of this girl in the red coat on your desk before tomorrow.,0,7134
She will put a picture of Bill on your desk before tomorrow.,0,7135
Bill will put a picture of her on your desk before tomorrow.,0,7137
Clean your desk before tomorrow.,0,7141
This girl will put a picture of Bill on your desk before tomorrow.,0,7142
"This boy must not go to school, and his father must not go to school either.",0,7143
"This boy must not go to France, but his father must go to France.",0,7144
This actress must play in this movie and she will play in this movie.,0,7145
Can Mary win the race and will Sue win the race too?,1,7146
This girl will buy bread and so will that one buy bread.,0,7147
The tourists will go to the park.,0,7148
Will the tourists go to the park?,1,7149
Some student from Australia speaks Chinese.,0,7150
Does some student from Australia speak Chinese?,1,7151
They would have been walking for hours.,0,7152
Would they have been walking for hours?,1,7153
"This girl will not buy bread, will she buy bread?",1,7154
"Sean Penn can act well in many kinds of movies, can't he act well in many kinds of movies?",1,7155
You will put a picture of Bill on your desk before tomorrow.,0,7156
This girl in the red coat or you will put a picture of Bill on your desk before tomorrow.,0,7157
No boys will put a picture of Bill on your desk before tomorrow.,0,7158
This girl in the red coat but no boys will put a picture of Bill on your desk before tomorrow.,0,7159
This girl in the red coat will put it and a picture of Bill on your desk before tomorrow.,0,7160
This girl in the red coat will put a picture of Bill in the mailbox before tomorrow.,0,7161
This girl in the red coat will put a picture of Bill on your desk after the dinner.,0,7162
This girl in the red coat will put a picture of Bill on your desk after the dinner and before tomorrow.,0,7163
This girl in the red coat will eat her breakfast before tomorrow.,0,7164
This girl in the red coat will eat her breakfast before tomorrow and put a picture of Bill on your desk before tomorrow.,0,7165
This girl in the red coat will eat her breakfast and will put a picture of Bill on your desk before tomorrow.,0,7166
This girl in the red coat will put a picture of Bill on your desk.,0,7167
This girl in the red dress must put a picture of Bill on your desk.,0,7168
John and Mary will play with Henry and with Sue.,0,7171
"They play unusual music, and I listen to unusual music.",0,7172
They play and I listen to unusual music.,0,7173
I love ice milk tea but you hate ice milk tea.,0,7174
I love but you hate ice milk tea.,0,7175
She may have thawed the roast and should have thawed the roast.,0,7176
She may have and should have thawed the roast.,0,7177
"Smith loaned a valuable collection of manuscripts to the library, and his widow later donated a valuable collection of manuscripts to the library.",0,7178
Smith loaned and his widow later donated a valuable collection of manuscripts to the library.,0,7179
"I borrowed large sums of money from the bank, and my sister stole large sums of money from the bank.",0,7180
I borrowed and my sister stole large sums of money from the bank.,0,7181
Mary should know that you must go to the station.,0,7183
"That you must go to the station, Mary should know that you must go to the station.",0,7184
It is your notes that John wants to look at after class.,0,7195
It is after class that John wants to look at your notes.,0,7196
It is John who wants to look at your notes after class.,0,7197
It was Ann who bought a first edition of Richard III for $1000.,0,7198
It was a first edition of Richard III that Ann bought for $1000.,0,7199
It was for $1000 that Ann bought a first edition of Richard III.,0,7200
Mary saw the tall man coming from England.,0,7202
Mary saw the tall man come from the back.,0,7204
It is a picture of Bill that this girl in the red coat will put on your desk before tomorrow.,0,7206
What John wants to look at now is your notes.,0,7208
It is to Cleveland that John drove the truck.,0,7211
What John became was deadly afraid of flying.,0,7212
John told us that he wants to quit school.,0,7214
What John told us is that he wants to quit school.,0,7216
John promised us to be gentle.,0,7217
Mary will arrive tomorrow.,0,7219
Henri wants the book which is on the top shelf.,0,7221
What Henri wants is the book which is on the top shelf.,0,7222
The spy became too friendly with his new contacts.,0,7223
What the spy became was too friendly with his new contacts.,0,7224
What this girl in the red coat will do is put a picture of Bill on your desk before tomorrow.,0,7225
Henri wants to buy these books about cooking.,0,7226
which books about cooking does Henri want to buy?,1,7227
I sent it to you.,0,7228
Bill's mother's friends are waiting at the restaurant.,0,7231
Bill's mother's friends and John are waiting at the restaurant.,0,7232
It was John that was waiting at the restaurant.,0,7233
It was John and Bill that were waiting at the restaurant.,0,7235
I will eat spaghetti on Sunday with Marco.,0,7236
I will speak to Hector about this.,0,7237
I doubt that Mary reads mysteries.,0,7238
He muttered that the visitors will leave.,0,7239
The fact that John is snoring is informative.,0,7240
The man that Mary saw knew me.,0,7241
That the visiting team won the race could surprise them.,0,7242
That is what you should see.,0,7243
John knows that she left.,0,7244
John knows whether she will come back.,0,7245
John knows that she left and whether she will come back.,0,7246
John knows that she left and John knows whether she will come back.,0,7247
John asked whether she left.,0,7248
I doubt if she kicks perfect goals every time.,0,7249
They think that she can do it.,0,7250
whether she left is most unclear.,0,7251
That the girl put a picture there proves her guilt.,0,7252
I prefer for the girl to put a picture there.,0,7253
For the girl to put a picture there is what I prefer.,0,7254
For the girl to put a picture there would surprise you.,0,7255
I prefer for the girl to win.,0,7256
Let's walk.,0,7259
I run on the beach.,0,7260
The three sunbathers went swimming.,0,7261
I hope that Mary wins.,0,7262
They know if Mary won.,0,7263
I wonder whether Mary will win.,0,7264
They prefer for Mary to leave.,0,7265
John wonders whether Mary will win.,0,7266
John wonders whether to win.,0,7267
Whether she will win is a question Mary never considered.,0,7268
Whether to win is a question Mary never considered.,0,7269
I think that you will see that the girl will put a picture on your desk.,0,7270
They understand that you will prefer for the girl to put a picture on your desk.,0,7271
Mary cuts the paper easily.,0,7272
The paper cuts easily.,0,7273
That he won the race could surprise them.,0,7274
For him to win the race would surprise them.,0,7276
John saw Mary.,0,7278
Harry likes movies.,0,7279
For Mary to leave on time is important.,0,7280
John can go to the market on his bike.,0,7283
Mary should buy some flowers on Sunday.,0,7284
My niece could write me letters before her third birthday.,0,7285
My nephew could write letters to his parents with a fountain pen.,0,7286
John can go to the market quickly.,0,7287
Mary should buy some flowers for her mother to arrange.,0,7288
My niece could write me letters more faithfully.,0,7289
John can quickly go to the market.,0,7290
My niece could more faithfully write me letters.,0,7291
John can go to the market on his bike on a truck.,0,7296
Mary should buy some flowers on Sunday at 5 o'clock.,0,7297
My nephew could write letters to his parents with a fountain pen with your help.,0,7298
Pelé visited his uncle.,0,7299
She sold the car to Sam for five dollars.,0,7300
She ran the car on propane from Reno to Vegas.,0,7301
The process changed the substance from solid to liquid to gas to energy.,0,7302
We associated their subsidiaries with our corporate office.,0,7303
I cycled around France.,0,7304
Mary drank some beer in the barn from 6 to nine.,0,7305
It was in the barn or it took place in the barn.,0,7306
They wonder whether Mary will run.,0,7308
They wonder about this.,0,7309
They wonder.,0,7310
I know that she runs.,0,7311
I know.,0,7312
I said that she runs.,0,7313
I said that.,0,7314
I prefer for Mary to run.,0,7316
I prefer this.,0,7317
I said for Mary to run.,0,7319
I said this.,0,7320
I put the book on the shelf.,0,7321
"Two ships appeared, arrived, remained, emerged.",0,7324
"Suddenly, there appeared two ships on the horizon.",0,7325
"Two inspectors from the INS appeared, arrived, remained, emerged.",0,7326
"The ice melts, breaks.",0,7327
"The door opens, closes.",0,7328
"They melted, broke the ice.",0,7329
"They opened, closed the door.",0,7330
"They cooked, thickened the soup.",0,7331
"I go, run, swim, jump, fly, crawl, dance, walk.",0,7332
I danced a dance.,0,7334
He walked the walk.,0,7335
The time elapsed slowly.,0,7336
I see stars.,0,7338
I see.,0,7339
I liked Mary.,0,7340
They surrounded the fort.,0,7342
I gave the charity.,0,7344
I gave money.,0,7345
I gave.,0,7346
I handed the ball to Reg.,0,7347
John ate.,0,7351
John knows.,0,7352
John saw.,0,7355
John told.,0,7356
The agency classified the documents.,0,7357
The war intensified the poverty.,0,7359
This project is manageable.,0,7360
it mattered on Sunday.,0,7361
I saw John on Sunday.,0,7362
I put the book on the desk on Sunday.,0,7363
I saw John with a telescope.,0,7364
I covered the bread with butter.,0,7366
Mary will complete her exam within an hour.,0,7368
The hiker will reach the top of the mountain within an hour.,0,7370
Henri will paint the floor for an hour.,0,7372
I will read linguistics for an hour.,0,7373
the student left.,0,7374
only the student left.,0,7375
even the student left.,0,7376
all the students left.,0,7377
I saw the student.,0,7378
I saw only the student.,0,7379
I saw all the students.,0,7380
"John, who I saw yesterday, will visit us.",0,7381
I saw the brilliant student.,0,7382
I saw the brilliant one.,0,7383
I saw the brilliant student with long hair.,0,7384
I saw the brilliant one with long hair.,0,7385
I saw the one with long hair.,0,7386
I saw the physics student.,0,7387
I saw the student of physics.,0,7389
I saw the student of physics with long hair.,0,7391
The big student of physics with long hair in the library.,0,7392
It is big.,0,7393
It is with long hair.,0,7394
It is in the library.,0,7396
They are intense.,0,7397
They intensified.,0,7399
They are special.,0,7400
They specialized.,0,7402
She is proud.,0,7403
she is the mother.,0,7404
she is the mother of John.,0,7405
They read the paper.,0,7406
The paper is readable.,0,7407
The driver of the car thinks that Mary should leave Dallas for Boise tomorrow.,0,7410
Her little sister will disagree with her.,0,7411
The girl he met at the departmental party will very surely call him.,0,7412
Beavers build dams.,0,7413
John will see you.,0,7414
John thinks that Mary left.,0,7415
John thinks Mary left.,0,7416
John whispered that Mary left.,0,7417
John will carefully study Russian.,0,7418
